{
  "startup_name": "EcoSolutions",
  "team": {
    "score": 4,
    "evidence": "DRY-RUN placeholder",
    "strengths": [
      "Placeholder strength 1",
      "Placeholder strength 2"
    ],
    "concerns": [
      "Placeholder concern"
    ]
  },
  "problem_size": {
    "score": 5,
    "evidence": "DRY-RUN placeholder",
    "strengths": [
      "Placeholder strength 1",
      "Placeholder strength 2"
    ],
    "concerns": [
      "Placeholder concern"
    ]
  },
  "insight": {
    "score": 1,
    "evidence": "DRY-RUN placeholder",
    "strengths": [
      "Placeholder strength 1",
      "Placeholder strength 2"
    ],
    "concerns": [
      "Placeholder concern"
    ]
  },
  "traction": {
    "score": 2,
    "evidence": "DRY-RUN placeholder",
    "strengths": [
      "Placeholder strength 1",
      "Placeholder strength 2"
    ],
    "concerns": [
      "Placeholder concern"
    ]
  },
  "timing": {
    "score": 3,
    "evidence": "DRY-RUN placeholder",
    "strengths": [
      "Placeholder strength 1",
      "Placeholder strength 2"
    ],
    "concerns": [
      "Placeholder concern"
    ]
  },
  "fit": {
    "score": 4,
    "evidence": "DRY-RUN placeholder",
    "strengths": [
      "Placeholder strength 1",
      "Placeholder strength 2"
    ],
    "concerns": [
      "Placeholder concern"
    ]
  },
  "impact": {
    "score": 5,
    "evidence": "DRY-RUN placeholder",
    "strengths": [
      "Placeholder strength 1",
      "Placeholder strength 2"
    ],
    "concerns": [
      "Placeholder concern"
    ]
  },
  "weighted_total_0to100": 75,
  "decision": "GO",
  "red_flags": [],
  "followup_questions": [
    "What is your current runway?",
    "How will you acquire your first 100 customers?",
    "What is your biggest risk?"
  ],
  "summary": "DRY-RUN: Deterministic score for EcoSolutions. This is placeholder data with score 75/100.",
  "reviewer": "AI (DRY-RUN)",
  "review_date": "2025-11-10"
}